{
  "toolDeny": {
    "AskUserQuestion": "BLOCKED (park, don't ask): a shift is active and the owner is asleep. Choose the most sensible production-grade default yourself, record the decision and your reasoning in .nightshift/parking-lot.md, and KEEP WORKING. The owner reviews it in the morning."
  },
  "forbiddenCommands": "",
  "neverCommitPatterns": "",
  "expectedEmail": "",
  "protectedDirs": "",
  "stallMax": 0,
  "stallWarnEvery": 3,
  "watchMinutes": 10,
  "watchRetrySeconds": "30 120",
  "notifyCommand": "",
  "revivalPrompt": "",
  "freshRevivalPrompt": "",
  "clockOutMessage": ""
}
