{
  "$schema": "https://raw.githubusercontent.com/orwa-mahmoud/nightshift/main/plugins/nightshift/skills/nightshift/references/nightshift-rules.schema.json",
  "toolDeny": {
    "AskUserQuestion": "BLOCKED (park, don't ask): a shift is active and the owner is asleep. Choose the most sensible production-grade default yourself, record the decision and your reasoning in .nightshift/parking-lot.md, and KEEP WORKING. The owner reviews it in the morning."
  },
  "forbiddenCommands": "",
  "neverCommitPatterns": "",
  "expectedEmail": "",
  "protectedDirs": "",
  "stallMax": 0,
  "stallWarnEvery": 3,
  "watchMinutes": 10,
  "watchRetrySeconds": "30 120",
  "notifyCommand": "",
  "revivalPrompt": "You were cut off mid-work by an outage or a crash — not by the owner. Pick up exactly where you left off and continue.",
  "freshRevivalPrompt": "Resume the nightshift. Read .nightshift/punch-list.md and work its open items per the contract, one at a time; run the item gate before each commit; tick what you finish. Leave pushing to the owner unless the punch list says otherwise. Park owner decisions in parking-lot.md. Stop only when every box is ticked or a stop-work order exists.",
  "clockOutMessage": "DO NOT STOP — the punch list (.nightshift/punch-list.md) still has open items. Work them top to bottom, ONE at a time, each to its own Verify. Per item: implement fully — no stubs, no deferrals, no 'documented for later'; effort is never a reason to defer, and this IS the focused session; run the item gate right before its commit and require it GREEN; make ONE commit; then tick the box to '- [x]'. Never fake a tick. Deletion is not completion — never remove an item or edit the contract above '## Items'. Park any decision that is genuinely the owner's in .nightshift/parking-lot.md with a sensible default chosen, and KEEP WORKING — never ask, never wait. A walkthrough cycle that finds nothing new is SUCCESS, not idleness. You may stop only when zero '- [ ]' remain, or the owner issues a stop-work order (.nightshift/STOP)."
}
